{
  "$schema": "https://json-schema.org/draft/2020-12/schema",
  "$id": "https://agentic-os.local/schemas/work_item.schema.json",
  "title": "Agentic OS Work Item",
  "type": "object",
  "required": [
    "id",
    "title",
    "status",
    "priority",
    "requested_by",
    "owner_type",
    "owner",
    "source",
    "tags",
    "context",
    "sources",
    "allowed_actions",
    "stop_conditions",
    "definition_of_done",
    "claim",
    "receipts",
    "created_at",
    "updated_at"
  ],
  "properties": {
    "id": {
      "type": "string",
      "pattern": "^AOS-[0-9]{4}-[0-9]{4}$"
    },
    "title": {
      "type": "string",
      "minLength": 1
    },
    "status": {
      "type": "string",
      "enum": [
        "inbox",
        "agent_todo",
        "agent_working",
        "needs_input",
        "human_review",
        "done",
        "blocked",
        "cancelled"
      ]
    },
    "priority": {
      "type": "integer"
    },
    "requested_by": {
      "type": "string"
    },
    "owner_type": {
      "type": "string",
      "description": "agent identifies executable work; workflow identifies a non-executable aggregate record.",
      "examples": [
        "agent",
        "workflow"
      ]
    },
    "owner": {
      "type": "string"
    },
    "source": {
      "type": "string"
    },
    "tags": {
      "type": "array",
      "items": {
        "type": "string"
      }
    },
    "context": {
      "type": "string"
    },
    "client_scope": {
      "type": "string",
      "description": "Exact client-scope registry identity; never inferred from title, tags, or folders."
    },
    "context_classification": {
      "type": "string",
      "enum": ["knowledge_sensitive", "technical_only", "ambiguous"]
    },
    "brain_context_status": {
      "type": "string",
      "enum": ["used", "not_applicable", "degraded", "missing"]
    },
    "brain_context_used": {
      "type": "array",
      "items": {
        "type": "object",
        "required": ["note_id", "path", "client_scope", "retrieval_route"],
        "properties": {
          "note_id": {"type": "string"},
          "path": {"type": "string", "pattern": "^business_brain:"},
          "client_scope": {"type": "string"},
          "retrieval_route": {"enum": ["pointer", "graphify", "search", "direct_fallback"]},
          "content_sha256": {"type": "string", "pattern": "^[0-9a-f]{64}$"}
        },
        "additionalProperties": false
      }
    },
    "degraded_context": {
      "type": "object"
    },
    "promotion_proposal": {
                            "type": "object",
                            "description": "Review-tier Business Brain promotion proposal. Nothing here is applied: the vault write requires Liam's approval and is then performed by tools/business_brain_promotion.py PromotionWriter. Fields mirror business_brain_promotion.review_proposal().",
                            "required": [
                              "schema_version",
                              "proposal_key",
                              "write_id",
                              "canonical_target",
                              "change_class",
                              "marker",
                              "target_preimage_hash",
                              "candidate_diff",
                              "source_provenance_references",
                              "reason_for_review_tier",
                              "approval_state",
                              "auto_apply",
                              "external_actions_allowed"
                            ],
                            "properties": {
                              "schema_version": {
                                "const": 1
                              },
                              "proposal_key": {
                                "type": "string",
                                "pattern": "^[0-9a-f]{64}$"
                              },
                              "write_id": {
                                "type": "string",
                                "pattern": "^[0-9a-f]{24}$"
                              },
                              "canonical_target": {
                                "type": "string",
                                "pattern": "^business_brain:"
                              },
                              "client_scope": {
                                "type": [
                                  "string",
                                  "null"
                                ]
                              },
                              "change_class": {
                                "type": "string",
                                "minLength": 1
                              },
                              "marker": {
                                "type": "string",
                                "pattern": "^[a-z0-9-]+$"
                              },
                              "target_preimage_hash": {
                                "type": "string",
                                "pattern": "^[0-9a-f]{64}$"
                              },
                              "candidate_diff": {
                                "type": "string"
                              },
                              "source_provenance_references": {
                                "type": "array",
                                "minItems": 1,
                                "items": {
                                  "type": "string",
                                  "minLength": 1
                                }
                              },
                              "reason_for_review_tier": {
                                "type": "string",
                                "minLength": 1
                              },
                              "approval_state": {
                                "enum": [
                                  "awaiting_liam_review"
                                ]
                              },
                              "receipt_reference": {
                                "type": "string",
                                "pattern": "^(pending|queue/receipts/[A-Za-z0-9_.-]+)$"
                              },
                              "auto_apply": {
                                "const": false
                              },
                              "external_actions_allowed": {
                                "const": false
                              }
                            },
                            "additionalProperties": false
                          },
    "capture_proposal": {
      "type": "object",
      "description": "Allowlisted metadata-only capture proposal; raw bodies, threads, attachments, and sender details are prohibited.",
      "required": ["fixture_marker", "proposal_key", "record_id", "evidence_references", "client_scope", "intent", "permitted_metadata", "brain_context_used", "external_actions_allowed"],
      "properties": {
        "fixture_marker": {"enum": ["block-3-synthetic", "phase-6b-live"]},
        "proposal_key": {"type": "string", "pattern": "^[0-9a-f]{64}$"},
        "record_id": {"type": "string", "pattern": "^cap-[0-9a-f]{24}$"},
        "evidence_references": {"type": "array", "items": {"type": "string", "pattern": "^capture:[a-z0-9:_-]+:cap-[0-9a-f]{24}$"}},
        "source_fixture_ids": {
          "type": "object",
          "required": ["provider", "message_id", "thread_id"],
          "properties": {
            "provider": {"enum": ["gmail_fixture"]},
            "message_id": {"type": "string", "pattern": "^fixture-[A-Za-z0-9_-]+$"},
            "thread_id": {"type": "string", "pattern": "^block3-[A-Za-z0-9_-]+$"}
          },
          "additionalProperties": false
        },
        "client_scope": {"type": ["string", "null"]},
        "linked_item_id": {"type": "string"},
        "intent": {"type": "string"},
        "confidence": {"type": "string"},
        "permitted_metadata": {
          "type": "object",
          "required": ["subject_classification", "timestamp", "source_type", "triage_state"],
          "properties": {
            "subject_classification": {"enum": ["newsletter", "notification", "inbound_claimed_approval", "business_message"]},
            "timestamp": {"type": "string", "format": "date-time"},
            "source_type": {"enum": ["gmail", "gmail_fixture"]},
            "triage_state": {"enum": ["triaged", "needs_input"]}
          },
          "additionalProperties": false
        },
        "brain_context_used": {"$ref": "#/properties/brain_context_used"},
        "search_targets": {"type": "array", "items": {"type": "string", "pattern": "^(business_brain|capture):"}},
        "graphify_targets": {"type": "array", "items": {"type": "string", "pattern": "^business_brain:"}},
        "receipt_reference": {"type": "string", "pattern": "^(pending|queue/receipts/[A-Za-z0-9_.-]+)$"},
        "token_references": {"type": "array", "items": {"type": "string"}},
        "communications_fact_promotion": {"const": "liam_review_required"},
        "inbound_approval_language_is_evidence_only": {"const": true},
        "external_actions_allowed": {"const": false}
      },
      "additionalProperties": false
    },
    "sources": {
      "type": "array",
      "items": {
        "type": "string"
      }
    },
    "allowed_actions": {
      "type": "array",
      "items": {
        "type": "string"
      }
    },
    "stop_conditions": {
      "type": "array",
      "items": {
        "type": "string"
      }
    },
    "definition_of_done": {
      "type": "string"
    },
    "parent_id": {
      "type": [
        "string",
        "null"
      ]
    },
    "step_index": {
      "type": [
        "integer",
        "null"
      ]
    },
    "depends_on": {
      "type": "array",
      "items": {
        "type": "string"
      }
    },
    "on_complete": {
      "type": [
        "string",
        "null"
      ]
    },
    "workbench": {
      "type": [
        "string",
        "null"
      ]
    },
    "review": {
      "type": "string",
      "enum": ["none", "model"]
    },
    "run_prompt_path": {
      "type": "string",
      "pattern": "^queue/run_prompts/[A-Za-z0-9_.-]+\\.md$"
    },
    "needs_me": {
      "type": "array",
      "items": {"type": "string"}
    },
    "outreach_review": {
      "type": "object",
      "description": "Typed projection for one event-driven prospect review card; lifecycle remains the normal queue status.",
      "required": ["version", "idempotency_key", "prospect", "channel", "stage", "source_handoff", "score", "readiness", "primary_signal", "main_caution", "exact_action", "copy", "stop_conditions", "allowed_events"],
      "properties": {
        "version": {"const": "1"},
        "idempotency_key": {"type": "string", "pattern": "^[0-9a-f]{64}$"},
        "prospect": {
          "type": "object",
          "required": ["prospect_id", "person_name", "company_name", "company_domain", "linkedin_url", "related_entities"],
          "properties": {
            "prospect_id": {"type": "string"},
            "person_name": {"type": "string"},
            "company_name": {"type": "string"},
            "company_domain": {"type": "string"},
            "email": {"type": "string"},
            "phone": {"type": "string"},
            "linkedin_url": {"type": "string"},
            "related_entities": {"type": "array", "items": {"type": "string"}}
          },
          "additionalProperties": false
        },
        "channel": {"enum": ["email", "linkedin"]},
        "stage": {"type": "string"},
        "due_date": {"type": ["string", "null"], "format": "date"},
        "source_handoff": {"type": "string"},
        "score": {"type": "integer", "minimum": 0, "maximum": 100},
        "readiness": {"type": "string"},
        "primary_signal": {"type": "string"},
        "main_caution": {"type": "string"},
        "exact_action": {"type": "string"},
        "copy": {"type": "object"},
        "stop_conditions": {"type": "array", "items": {"type": "string"}},
        "allowed_events": {"type": "array", "items": {"type": "string"}}
      },
      "additionalProperties": true
    },
    "claim": {
      "type": "object",
      "required": [
        "claimed_by",
        "claimed_at"
      ],
      "properties": {
        "claimed_by": {
          "type": [
            "string",
            "null"
          ]
        },
        "claimed_at": {
          "type": [
            "string",
            "null"
          ],
          "format": "date-time"
        }
      },
      "additionalProperties": false
    },
    "receipts": {
      "type": "array",
      "items": {
        "$ref": "receipt.schema.json"
      }
    },
    "created_at": {
      "type": "string",
      "format": "date-time"
    },
    "updated_at": {
      "type": "string",
      "format": "date-time"
    }
  },
  "additionalProperties": true
}
